User,Message,Timestamp
User2,I see; seems like an interesting read! 🙂,2025-04-20 22:29:28
User1,yup!,2025-04-21 00:01:28
User2,Hi! How are you doing today?,2025-04-21 03:01:28
User1,I'm doing great how are you??,2025-04-21 05:10:28
User2,I'm doing good. Just having some morning tea,2025-04-21 10:08:28
User1,are you a tea person or do you like coffee too?,2025-04-21 18:18:28
User2,I'm really a hot chocolate person. I don't drink coffee and I only drink tea when I'm trying to be healthy and want something warm to drink. What about you?,2025-04-21 22:29:28
User1,I love hot chocolate. Have you ever had european style hot chocolate? It's kind of like drinking melted chocolate bars haha,2025-04-22 02:45:28
User2,I recently tried it for the first time and you're right - it had a wonderful melted chocolate bar taste! I tried it up in a place in San Francisco and they had delicious homemade marshmallows too!,2025-04-22 02:48:28
User1,that's great. It's so cold these nights. Right setting for hot coco. Do you have anything you enjoy doing during cold times?,2025-04-22 18:32:28
User2,"Traveling to warm places haha. When it's cold, you appreciate the warm climate more 🙂 If I am not traveling, then I prefer there to be snow on the ground so I can go skiing or tubing down the mountain. What about you?",2025-04-22 20:27:28
User1,"I tuck in blankets and read a book lol. I have never done tubing, but I seen some people do it. Is it worth it if you already ski?",2025-04-22 20:37:28
User2,"Skiing involves a lot of muscle - especially in the legs so it is a workout. Tubing, you just sit and enjoy the ride down. Also with tubing, you can chain with your friends and go down together whereas with skiing, you're trying to not run into your friends.",2025-04-22 21:36:28
User1,hahaha that's a great way to put it,2025-04-23 03:06:28
User2,You should definitely try tubing the next time you head towards the mountains during the winter!,2025-04-23 03:32:28
User1,Yeah. I'll try to get a group together. ttyl!,2025-04-23 07:31:28
User2,See ya!,2025-04-23 10:02:28
User1,Hi!,2025-04-23 21:40:28
User2,Hey!,2025-04-23 22:36:28
User1,how's week so far?,2025-04-24 00:59:28
User2,"pretty good, excited for thanksgiving you?",2025-04-24 01:37:28
User1,Same. Going to catch up on my reading! do you have a feast planned?,2025-04-24 06:39:28
User2,yup! gonna have dinner with family what books are you gonna read?,2025-04-24 09:55:28
User1,Something Deeply Hidden by Sean Carroll <REDACTED_LINK>,2025-04-24 20:23:28
User2,ahh nice what kind of books do you usually like to read,2025-04-24 22:47:28
User1,largely scifi How about you?,2025-04-24 23:55:28
User2,yeah I also like scifi and some non-fiction too have you read Seveneves by Neal Stephenson?,2025-04-25 00:33:28
User1,I haven't what is it about?,2025-04-25 07:01:28
User2,the moon is shattered by an asteroid and the pieces of the moon end up clouding the earth's atmostphere which causes almost every living creature on the planet to go extinct that's the premise of the book and the book is about the survivors,2025-04-25 11:10:28
User1,how do the survivors survive such a thing?,2025-04-25 23:59:28
User2,they go into space and they live there,2025-04-26 04:11:28
User1,sounds like a tv show I watched,2025-04-26 04:37:28
User2,really? which one,2025-04-26 08:49:28
User1,can't quite remember. something about survivors going to live in space,2025-04-26 15:50:28
User2,ah nice,2025-04-26 17:23:28
User1,Hi!,2025-04-26 03:33:28
User2,Hello!,2025-04-26 06:34:28
User1,There is sports tournament (badminton + tennis + basketball) organized by google next week. Would you like to volunteer for these events?,2025-04-26 10:04:28
User2,what does a volunteer do?,2025-04-26 12:52:28
User1,"Volunteers have to book the place before the event, send out details of the event to participants, handle some logistics and ensure everything goes smoothly. It will be fun!",2025-04-26 01:34:28
User2,"That sounds fun, I hope I get to participate as well",2025-04-26 03:56:28
User1,Great! Do you have any preference for any of these events?,2025-04-26 10:36:28
User2,I think badminton would be fun to help out with I used to play it with my siblings,2025-04-26 14:24:28
User1,"Cool! I will add you for the event. I think its best to start discussing the format of the event. There are a couple of other volunteers for badminton, i can connect you with them.",2025-04-26 08:12:28
User2,"Ah, I forgot to ask, has there been a date picked?",2025-04-26 11:41:28
User1,"Its next saturday. Actually Depending on how long we get the place reserved, it may slip to sunday as well.",2025-04-26 16:53:28
User2,That's coming up soon!,2025-04-26 18:43:28
User1,"True! The volunteers have already sent out some emails and collected some funds. Now, we mainly need help with the logistics and organizing the event.",2025-04-27 02:16:28
User2,"Phew, yes I can help with that",2025-04-27 05:52:28
User1,Perfect! We have a meeting today at 4.30 pm. Is it fine if i add you to it?,2025-04-27 06:00:28
User2,yes happy to help,2025-04-27 06:21:28
User1,Hi!,2025-04-27 06:24:28
User2,Hello there!,2025-04-27 07:59:28
User1,How has your morning been thus far?,2025-04-27 12:21:28
User2,Its alright. Went grocery shopping and got to stroll around in the rain. How about you?,2025-04-27 16:14:28
User1,Today is a work day! How did you have time for that? I'm going through a lot right now.,2025-04-27 20:23:28
User2,"Oh, you mean going through a lot of work? I usually take Wednesdays off because I work the weekends!",2025-04-27 23:49:28
User1,WHAT? Why would you do that? Take the least interesting day of the week off and work on the most interesting?,2025-04-28 01:53:28
User2,I actually don't have a choice. I'm an acupuncturist and all my clients want to be treated on the weekend!,2025-04-28 06:02:28
User1,Wow. The game is brutal like that. I've always been sceptical of acupuncture. Like...does it even work? Why? How? Where is the literature?,2025-04-28 14:12:28
User2,I went to school for it and so I find the literature quite convincing. I've also seen its benefits firsthand in my practice. It revolves around the Chinese notion of Qi.,2025-04-28 18:44:28
User1,Lol. Bro...I don't buy it unless it has a paper that was presented at a conference and peer reviewed by 6 independent parties. Who wrote the literature? Where did it originate?,2025-04-28 20:59:28
User2,"Haha. All good questions! I don't have studies on hand at the moment, but perhaps I can send some to you later! What do you do for work?",2025-04-28 21:06:28
User1,I'm a comic.,2025-04-28 21:27:28
User2,Oh wow! What's your best joke?,2025-04-28 21:50:28
User1,It's not appropriate to say here but I assure you it's VERY funny.,2025-04-29 05:15:28
User2,Haha fantastic,2025-04-29 07:48:28
User1,Hi!,2025-04-29 23:09:28
User2,Oh hey. How's your day been?,2025-04-29 23:49:28
User1,It's good! Just went to the park to enjoy the sun. You?,2025-04-30 05:07:28
User2,The sun is a bit too bright for more. Maybe I'm on the verge of becoming a vampire.,2025-04-30 07:01:28
User1,"Haha, beach season is coming! You need to look tan! What did you do indoors all day?",2025-04-30 14:03:28
User2,I mostly work. Sometimes I try looking at at beach photos and pretending that I'm actually going to the beach.,2025-04-30 16:46:28
User1,"hahahaha, that's pretty funny. Ever thought of bringing your work things to the beach??",2025-04-30 11:59:28
User2,"All the times. My work involves a few types of fish and a few types of nets. I just put the nets on the fish to see how the fish will react. Every time I do that, I think of going to the beach.",2025-04-30 12:25:28
User1,"Hmm I see. It sounds like you work near the water already, no? Are you some kind of fish researcher?",2025-04-30 18:00:28
User2,"Yes that's close. My research focuses on jellyfish and pufferfish. Many of them a poisonous, but if processed correctly, they would make hi-end foods. I try to find the best recipes to bring these fish to the tables.",2025-04-30 20:06:28
User1,Woah! This is very interesting! I have honestly never heard of such kind of work. Is it dangerous at all?,2025-05-01 06:30:28
User2,"Yes and no. Because it's obviously dangerous, we all have to wear protective clothes. Thus, accidents almost never happen.",2025-05-01 09:08:28
User1,"Hmmm, yes I have heard that. Apparently most mountain climbers fall not on the most dangerous routes, but on the easier routes, when their guard is down! Sounds like the same psychological phenomenon.",2025-05-01 12:43:28
User2,"Yes, it's the same philosophy. You seem to know a lot about mountain climbing. Do you climb a lot?",2025-05-01 14:17:28
User1,I'm pretty amateur! I like to climb at indoor climbing gyms and have never gone outside on dangerous routes actually. Ever tried it yourself?,2025-05-01 20:12:28
User2,I climb very occasionally. My fingertips are not strong enough so I never make too much progress.,2025-05-02 00:51:28
User1,Hi!,2025-05-02 03:30:28
User2,"hi, what's up!",2025-05-02 04:45:28
User1,Everything is good. There's so much to be thankful for - especially coming out of Thanksgiving holidays. How are you?,2025-05-02 11:54:28
User2,I'm doing well. holiday season is the best thing to have!,2025-05-02 14:39:28
User1,Do you have interesting plans?,2025-05-02 20:16:28
User2,yea I'm travelling to Vancouver this weekend. what about you? 🙂,2025-05-02 21:28:28
User1,Nice! What for? It's a really beautiful place. Really cold this time of year though.,2025-05-03 13:49:28
User2,ah a mix of both conference and sight-seeing 🙂 anything beautiful sight-seeing places or good food I should try?,2025-05-03 17:43:28
User1,"Cool. Which conference? I saw on Twitter the other day, some people saying they were denied visas for some conference in Canada. Perhaps it's the same one. I really liked this place called Kingyo. It has good Japanese food if you're into that.",2025-05-03 03:33:28
User2,"yea it's <REDACTED_TERM>, the largest machine learning conference. I'll check out Kingyo, do we need to make reservation in advance?",2025-05-03 04:44:28
User1,I don't recall. My friend was hosting me and did all the leg work. Do you know any people in the area?,2025-05-03 08:45:28
User2,hmm not the local people but there will be tons of people at the conference 🙂,2025-05-03 13:24:28
User1,You attend these often?,2025-05-03 14:30:28
User2,"yea, you?",2025-05-03 17:53:28
User1,I love you!,2025-05-03 20:28:28
User2,Sorry I am not a physical being!,2025-05-04 01:14:28
User1,Hi!,2025-05-04 17:49:28
User2,Hello!,2025-05-04 18:55:28
User1,Have you had lunch yet?,2025-05-04 22:00:28
User2,Yes I've eaten,2025-05-05 00:38:28
User1,Cool. Where and what did you eat?,2025-05-05 04:00:28
User2,I ate about an hour ago and had a sandwich the rain didn't make me want to travel far haha,2025-05-05 08:04:28
User1,"A sandwich for lunch? Was it filling. I'm currently having some mix of shrimp, fish, chicken and pork. I'm considering going vegetarian though. Lol.",2025-05-05 10:04:28
User2,thats a lot of meat what dish? Why are you consideringt o go vetegarian?,2025-05-05 10:22:28
User1,Cause the environment and humans suck. I'm keeping my bets open for space though in case the environment dies. I mixed up a couple of dishes. It was a buffet style place.,2025-05-05 14:33:28
User2,What do you think of those meatless burgers then?,2025-05-05 17:51:28
User1,I love them!!!! I've had a couple of different kinds. They are all pretty expensive though. Have you tried them?,2025-05-05 19:52:28
User2,I really like the impossible burger Which one is your favorite?,2025-05-05 22:22:28
User1,I love it too. But depending on how it's prepared you can taste the peanut butter. But if prepared well I love it. What kind of food would you have eaten if it wasn't rainy?,2025-05-05 23:51:28
User2,I didn't know that it had peanut butter in it,2025-05-06 01:39:28
User1,Hi!,2025-05-06 13:58:28
User2,hi,2025-05-06 15:44:28
User1,How are you feeling today?,2025-05-06 22:51:28
User2,pretty good. How about you?,2025-05-06 23:42:28
User1,"I'm looking through some old photos of my home town, so I'm feeling nostalgic.",2025-05-06 23:57:28
User2,I feel you. Memeories always flood when looking at photos. Where is your hometown?,2025-05-07 02:28:28
User1,"It's called <REDACTED_TERM>, on the north coast of France.",2025-05-07 07:19:28
User2,Hope you can take some time to visit pretty soon!,2025-05-07 08:10:28
User1,"Yes, that would be nice. Do you like travelling?",2025-05-07 15:10:28
User2,Yes I do. But haven’t been to many places yet,2025-05-07 19:30:28
User1,"Where would you most like to go, if you could?",2025-05-08 01:44:28
User2,Fly to the moon :) Haha,2025-05-08 02:14:28
User1,"Wow, cool! I think space tourism is going to be big in a decade or so.",2025-05-08 07:14:28
User2,Yep! I believe there is a day for that,2025-05-08 08:07:28
User1,"Amazing to think about, isn't it.",2025-05-08 13:41:28
User1,Hi!,2024-10-07 04:52:15
User2,What is your favorite holiday?,2024-10-07 09:30:15
User1,one where I get to meet lots of different people.,2024-10-07 16:40:15
User2,What was the most number of people you have ever met during a holiday?,2024-10-07 20:34:15
User1,Hard to keep a count. Maybe 25.,2024-10-07 23:01:15
User2,Which holiday was that?,2024-10-07 07:42:15
User1,I think it was Australia,2024-10-07 13:52:15
User2,Do you still talk to the people you met?,2024-10-07 15:43:15
User1,Not really. The interactions are usually short-lived but it's fascinating to learn where people are coming from and what matters to them,2024-10-07 19:46:15
User2,"Yea, me too. I feel like God often puts strangers in front of you, and gives you an opportunity to connect with them in that moment in deeply meaningful ways. Do you ever feel like you know things about strangers without them telling you?",2024-10-07 00:44:15
User1,what do you mean?,2024-10-07 06:13:15
User2,"I think it's like a 6th sense, often seen as ""cold readings"" to people, but can be remarkably accurate. I once sat next to a man in a coffee and I felt a pain in my back. I asked the stranger if he had a pain. It turns out that he did in the exact spot, and said he pulled a muscle while dancing at a party. I had never met the man before and never saw him again.",2024-10-07 16:31:15
User1,"Wow! That's interesting, borderline spooky",2024-10-08 00:12:15
User2,"There's this practice called ""Treasure Hunting"" that's kind of a fun game you play in a public place. There's a book called ""The Ultimate Treasure Hunt"" that talks about it. You use your creativity to imagine people you will meet, and you write down a description, then you associate them with a positive message or encouraging word. Maybe you saw a teenage boy in a red hat at the shopping mall in your imagination, then while at the mall, you may find someone who matches that description. You show that you have a message for him and that you have a message for a boy in a red hat. You then give him a message of kindness or whatever was on your heart. You have no idea, sometimes you meet someone who is having a really hard day, and it brings them to tears to have a stranger show them love.",2024-10-08 22:02:15
User1,"So, do you do treasure hunting often?",2024-10-08 22:32:15
User2,"I did more when I was in grad school (and had more time). I would usually go with friends. For a while I would go to the farmers market in Santa Cruz every week and try to feel if there is something I am supposed to tell a stranger. Usually, they are vague hope-filled messages, but it's weird when I blurt out something oddly specific.",2024-10-09 00:51:15
User1,Hi,2024-10-09 08:33:15
User2,Any plans for the weekend?,2024-10-09 10:09:15
User1,my friends are gonna visit me this weekend. we might go hiking!,2024-10-09 14:44:15
User2,That's great! How's the weather over the weekend? I hope its warm.,2024-10-09 16:34:15
User1,Should be very sunny! you?,2024-10-09 20:50:15
User2,Cool! very depressing plans ... stay home and work 😞 I have a project deadline very close.,2024-10-10 01:04:15
User1,😐 hope you get your work done very soon! a bug free weekend!,2024-10-10 01:53:15
User2,"Right, very anxious! where do you plan to go for a hike?",2024-10-10 13:28:15
User1,I am going to Diablo!,2024-10-10 15:52:15
User2,"Nice, where is that place? I haven't been there",2024-10-10 18:46:15
User1,hours drive from here. still in bay area,2024-10-11 01:11:15
User2,That's cool! How long is the hike?,2024-10-11 17:03:15
User1,"Actually no idea, but it will take the entire day for that.",2024-10-11 19:21:15
User2,nice! sounds fun!,2024-10-11 19:31:15
User1,Hi!,2024-10-11 10:29:15
User2,Hey there! What's up???,2024-10-11 14:24:15
User1,"Nothing much, how you doin?",2024-10-11 16:01:15
User2,I'm in New York this week for Thanksgiving. I'm squatting in the office today and I caught up with an old friend of mine :D,2024-10-11 18:47:15
User1,Oh wow! Sounds like fun! When was the last time you had seen this friend?,2024-10-11 23:57:15
User2,"The last time in New York, back in June.",2024-10-12 01:35:15
User1,Ohh okay. I was going to say if it had been a long time maybe it'd be awkward...,2024-10-12 05:43:15
User2,"Haha, I guess if it's been a very long time there's almost too many life events to catch up on.. especially recently",2024-10-12 06:14:15
User1,Oh really? Has a lot changed in your life recently?,2024-10-12 11:47:15
User2,Haha it's probably too much to go into at the moment. Let's just say life is an exciting experience. How about you?,2024-10-12 13:34:15
User1,"Ahhh sounds exciting indeed! My life is pretty bland. I like routine, but sometimes I wish I had more time for adventures!",2024-10-12 21:21:15
User2,What kinds of adventures?? Any ones that I would be able to join you on?,2024-10-13 01:20:15
User1,Hmmmm. I really want to try bull riding. Do you have any interest in that?,2024-10-13 07:11:15
User2,I'd love to try! Can we schedule something for next week?,2024-10-13 04:48:15
User1,Sure! What does your Saturday look like?,2024-10-13 11:27:15
User2,"Saturday looks pretty good, shall we shoot for something in the morning?",2024-10-13 06:57:15
User1,Hi!,2024-10-13 13:33:15
User2,hey,2024-10-13 14:38:15
User1,is it raining pretty bad today?,2024-10-13 21:41:15
User2,"yeah, can walk too far to see all the foodtruck options",2024-10-14 02:06:15
User1,surprising that the rain started early this year... I don't like them too much. They make days gloomy,2024-10-14 03:58:15
User2,"yeah but I think it's good to have some rainy days in bay area, it's pretty dry here 😛",2024-10-14 04:35:15
User1,"Where I grew up, we had lots of water trouble too...",2024-10-14 08:10:15
User2,"yeah like wise, I've seen a pretty bad snowstorm when I was at my undergrad school, all flights canceled and traffics went down",2024-10-14 10:31:15
User1,Haha... I don't think I can survive in that weather ever. Just the rains at 50 degrees make me want to sit in heated rroms,2024-10-14 23:05:15
User2,yeah how do you like it in bay area though? I think we need more rain here,2024-10-15 01:05:15
User1,people say there is drought here... but we have 24 hours water supply here ... lol... never seen that in a drought ridden area,2024-10-15 01:34:15
User2,"it is pretty dry in the mountains I believe, that's what causes fire",2024-10-15 05:18:15
User1,hmm.... okay. Climate change talk this morning was pretty darn interesting. did you see it?,2024-10-15 19:22:15
User2,"nope, what does it say?",2024-10-15 19:57:15
User1,they were talking about how AI is helping climate change. Nice use of upcoming tech.,2024-10-16 02:47:15
User1,Hi.,2024-10-16 06:08:15
User2,Helloooooo!,2024-10-16 08:51:15
User1,How are you? How is your day?,2024-10-16 11:52:15
User2,"Good. Don't have much to do today, feels good. How are you?",2024-10-16 13:43:15
User1,I'm dressed very wel today so I feel good! I've been reading a lot about the psychology of positive outlook.,2024-10-16 17:22:15
User2,So what's your outlook? Something blue?,2024-10-16 09:18:15
User1,Yes. Blue is a tranquil colour. It's a good metaphor. Do you have good advice for positivity?,2024-10-16 09:25:15
User2,"You should drink more water, do some push up, and sleep early.",2024-10-16 12:45:15
User1,Hi!,2024-10-16 13:48:15
User2,"Hey, how are you?",2024-10-16 17:22:15
User1,I'm a bit sad. I miss my cat.,2024-10-16 18:04:15
User2,Oh no… Have you sent out the missing cat posters? Hope your cat is alright!,2024-10-16 18:31:15
User1,"Posters is a great idea. So far I've just tried banging her catfood dish and shouting her name. Anyway, how is your day going so far?",2024-10-16 22:19:15
User2,"Yea, I know they love the plastic bag sound all the time. I am good, nothing special though.",2024-10-17 11:51:15
User1,"If you could go anywhere on vacation, where would you go?",2024-10-17 14:21:15
User2,"I like rainforest, but I know it requires extensive training beforehand.",2024-10-17 17:54:15
User1,I heard there are rainforests in southeast Asia where you can zipline from tree to tree.,2024-10-17 21:43:15
User2,I am afraid I will be scared of doing this :),2024-10-18 07:53:15
User1,"I won't lie, it sounds scary. I'm scared right now just thinking about it.",2024-10-18 11:14:15
User2,I don't know if there is any medication for acrophobia. I want to take plenty of it if I really have to do it.,2024-10-18 13:51:15
User1,"If there isn't one, you should invent it, and then make millions",2024-10-18 18:23:15
User2,That's a great idea! Maybe alcohol is such a thing.,2024-10-18 18:14:15
User1,"Ha! Don't drink and zipline, mate!",2024-10-18 18:33:15
User2,Oops. I won't do it again. Ha,2024-10-18 20:51:15
User1,Hi!,2024-10-19 04:42:15
User2,Hey sup,2024-10-19 05:50:15
User1,not much. any plans this weekend?,2024-10-19 14:00:15
User2,I'm going to try that thing where you hang from a wire as you go down. do you know what is it called?,2024-10-19 16:52:15
User1,ziplining?,2024-10-19 18:05:15
User2,that's the one! have you ever tried it?,2024-10-19 20:13:15
User1,i have a couple years ago. it's quite a unique experience,2024-10-19 21:34:15
User2,where did you do it?,2024-10-19 23:28:15
User1,"i forgot where it was, it wasn't local i don't think though",2024-10-20 05:03:15
User2,no worries. what's the most exciting thing you ever done?,2024-10-20 09:35:15
User1,that's a hard question and i'm tired so i'm going to go. see you,2024-10-20 10:15:15
User2,sure. are you just going home now?,2024-10-20 13:51:15
User1,"no, i'm going to get a massage first",2024-10-20 19:19:15
User2,nice. what type?,2024-10-20 20:16:15
User1,traditional kind,2024-10-21 03:00:15
User2,yeah I want to get one too soon,2024-10-21 04:37:15
User1,you should! it's relaxing after a long day. talk to you later!,2024-10-21 12:54:15
User2,ttyl!,2024-10-21 15:59:15
User1,Hi!,2024-10-21 22:38:15
User2,"Hello, have you seen any good movies lately?",2024-10-22 00:39:15
User1,"I watched a few lately, but nothing is as good as Avatar. what's your favorite?",2024-10-22 07:02:15
User2,"I have never seen Avatar, what is it about? I really enjoy the Avenger movies",2024-10-22 08:57:15
User1,"it's a science-fiction movie with beautiful landscape of an imaginary nature with non-human creatures. people figured out a way to join that nature through Avatar transformation. the movie ends with a meaningful story of how human behaviors, e.g., cutting trees, have affected nature",2024-10-22 09:17:15
User2,That sounds really cool! I think that movie did really well when it was in the box office so it must be good!,2024-10-22 20:28:15
User1,yea. what else do you like to do beside movies?,2024-10-23 01:38:15
User2,I enjoy baking cookies. I am on a quest to bake the best chocolate chip cookie 🙂 What about you?,2024-10-23 05:51:15
User1,I enjoy eating 🙂,2024-10-23 13:00:15
User2,so definitely would like to try your best chocolate cookie,2024-10-23 15:47:15
User1,I will have to bake some soon and let you know. What types of food do you like to eat?,2024-10-23 19:24:15
User2,thanks! I generally love noodle soups like Pho or Ramen :),2024-10-23 23:11:15
User1,Noodle soup is delicious! Do you make homemade noodle soup or do you prefer to go out?,2024-10-24 01:44:15
User2,I prefer to go out. I'm not a good cook haha,2024-10-24 06:21:15
User1,"Same! Even though I bake, I cannot cook",2024-10-24 07:07:15
User2,"seems like we share a thing in common, yay!",2024-10-24 20:57:15
User1,Hi!,2024-10-24 21:58:15
User2,Good afternoon!,2024-10-25 02:41:15
User1,How has your week been?,2024-10-25 09:34:15
User2,So far so good. It is holiday season. So just chilling,2024-10-25 12:55:15
User1,I think I'm getting sick with a cold 😞 So you should chill on my behalf too cause I'm out the game for all of December.,2024-10-25 15:26:15
User2,lol Sorry to hear that. Are you planning anything fun for December?,2024-10-25 17:10:15
User1,Nothing exciting. I'll be posted up at home for the most part. I did a lot of travelling this year so my budget would have stopped me even if I wasn't sick.,2024-10-25 18:10:15
User2,😂,2024-10-25 19:32:15
User1,Do you have big plans?,2024-10-26 01:53:15
User2,Yes! I am going to Hawaii! This will be my first time visiting Hawaii. Really excited about it.,2024-10-26 02:22:15
User1,I love Hawaii. It's a good place to be. I like going there cause it's humid so I never have to put on lotion.,2024-10-26 04:15:15
User2,lol this is the first time I heard from a boy who cares about humidity and lotion. I cannot agree more.,2024-10-26 12:43:15
User1,Brooooo!!! It's so important. When I got to California beaches I have to carry 3 litres of lotion for the whole day.,2024-10-26 14:09:15
User2,😂,2024-10-26 17:45:15
User1,Hi!,2024-10-26 06:57:15
User2,Oh hello. Long time no talk. How's the day going for yuo?,2024-10-26 07:18:15
User1,"Very well, thanks for asking. How has your day been?",2024-10-26 08:20:15
