User,Message,Timestamp
User2,I guess I can practice?,2024-12-29 22:49:28
User1,Is that something you can practice?,2024-12-30 19:33:28
User2,I don't know tbh,2024-12-30 21:41:28
User1,I honestly thought it was one of those things you have to be born with... Not that you shouldn't try though!,2024-12-31 14:08:28
User2,good point. I should ask my teacher if I have to be born with that,2024-12-31 18:39:28
User1,Maybe its a little too early to even be thinking about this. Just aim for med school and enjoy the journey!,2025-01-01 01:12:28
User2,yeah,2025-01-01 04:53:28
User1,What other subjects do you enjoy? Try to keep an open mind!,2025-01-01 05:31:28
User1,Hi!,2025-01-01 21:57:28
User2,Hi. This is a pleasant surprise.,2025-01-02 00:55:28
User1,Haha...thanks! how did you like the gift?,2025-01-02 05:21:28
User2,Currently unpacking it I guess. How's your morning?,2025-01-02 06:43:28
User1,Hope you like it! Morning is good. Busy finishing up stuff before the holidays.,2025-01-02 11:09:28
User2,I think I traveled too much the last couple of months so no holiday for me. But I'm okay with that. Going anywhere exciting?,2025-01-02 12:58:28
User1,Yes,2025-01-02 20:09:28
User2,Where to?,2025-01-02 22:34:28
User1,Hawaii... looking forward to warm beaches.,2025-01-02 23:16:28
User2,WOW. Which island? I like Hawaii.,2025-01-03 04:02:28
User1,Mauii...Hope I like it too. Never been there before.,2025-01-03 07:34:28
User2,"I visited Maui. It's my second favourite island I've been to, globally. You should try driving on road to Hana. It's a whole day thing but it's worth it.",2025-01-03 12:17:28
User1,Awesome! Thanks for the tip.,2025-01-03 19:53:28
User1,Hi!,2025-01-04 00:55:28
User2,Hi! Sorry for the late response. How are you doing?,2025-01-04 04:35:28
User1,"I'm great, thanks! I'm meeting some friends for a soccer game soon. What about you?",2025-01-04 06:15:28
User2,I just got a matcha latte 🙂 Doing some work at my desk. Do you play soccer often? I'm trying to get into doing a regular physical activity,2025-01-04 08:01:28
User1,"Yes, but I'm terrible at it. It's fun to play anything with friends, I think. Would you prefer to exercise with a group, or by yourself, do you think?",2025-01-04 17:07:28
User2,I think playing a team sport would be fun if it's casual but I primarily run by myself if I exercise. I also got the Ring Fit adventure game on the switch recently. It's basically a game-ified way to exercise,2025-01-04 20:01:28
User1,"I'm thinking about getting a Switch, would you recommend it?",2025-01-04 15:51:28
User2,Yes! There are a lot of really great games on the Switch. Two of my favorites are Octopath Traveler and Fire Emblem. Do you play a lot of video games?,2025-01-04 19:27:28
User1,I'm not much of a gamer but it's something I'd like to get into.,2025-01-05 19:38:28
User2,What do you do in your free time?,2025-01-05 22:55:28
User1,"I like to read for fun. I just finished a book called Temeraire. It's an adventure story set in the Napoleonic navy, like Patrick O'Brien, except there are dragons too.",2025-01-06 07:15:28
User2,Oh cool! I read a lot for fun too 🙂 My favorite genre is sci-fi fantasy.,2025-01-06 10:16:28
User1,What's the most recent good thing you read?,2025-01-06 12:55:28
User2,"My recent favorites have been mostly sci-fi (Exhalations, Vita Nostra and Dark Matter) but I like a lot of Sanderson/Garth Nix fantasy books",2025-01-06 14:00:28
User1,Hi!,2025-01-06 16:15:28
User2,"hey, what's up?",2025-01-06 19:52:28
User1,What do you think about human like chat bots?,2025-01-06 13:42:28
User2,I can't wait for them to be great conversationalists!,2025-01-06 17:00:28
User1,"Yep, we seemed to have made some great progress over last few years. Do you think the positives outweigh the negatives",2025-01-06 17:04:28
User2,are there even any negatives? what are they?,2025-01-06 17:14:28
User1,Like impersorsination? Though it sounds far fetched :),2025-01-06 20:03:28
User2,People can already impersonate other people though! I think it'd be great to have bots to converse with,2025-01-06 20:25:28
User1,True that! Some of these bots are very engaging and funny. They are now good at even sarcasm I wonder how far are we from the time these bots start giving monologues :),2025-01-07 00:43:28
User2,What do you think are the big advantages? Like personal assistants?,2025-01-07 04:07:28
User1,I think it can take many different forms as a product. The research implication is also huge! It will signify how AI research has progressed so far and better place to tackle more futuristic problems 🙂 Sort of like stepping on the moon 🙂 I might be overselling it here 😛,2025-01-07 04:32:28
User2,"No, I agree -- it's such an exciting time to be alive to get to witness all this and be a part of it. I wonder if I'll be able someday to get a chatbot to just auto-suggest conversations for me",2025-01-07 05:23:28
User1,The current auto-suggestions already do pretty good 🙂,2025-01-07 12:47:28
User2,"Yeah those are actually really good for a few words! I'm imagining like it comes up with a whole conversational response, like a default template",2025-01-07 13:45:28
User1,"haha, pretty far fetched 🙂 Nice having this conversation with you!",2025-01-07 05:43:28
User2,Same with you!,2025-01-07 06:57:28
User1,Hi!,2025-01-07 08:13:28
User2,Hi!,2025-01-07 09:30:28
User1,Any big plans for the upcoming holidays?,2025-01-07 09:42:28
User2,"Sorry for the late response -- Yes, I will be going skiing in Tahoe over the holidays.",2025-01-07 13:50:28
User1,That sounds amazing. I want to learn how to ski but I feel like I'm too old and falls would have lifelong impacts. Are you going with friends?,2025-01-07 21:28:28
User1,Hi!,2025-01-08 13:40:28
User2,Hi 🙂,2025-01-08 17:41:28
User1,I just came back from work. so tired,2025-01-09 00:44:28
User2,Oh I am sorry to hear! What did you work on?,2025-01-09 05:34:28
User1,I'm a lawyer. so talking to clients most of the day,2025-01-09 06:02:28
User2,Oh you are a lawyer. I've been so interested in this profession.,2025-01-09 10:00:28
User1,really? why?,2025-01-09 17:10:28
User2,it's so stressful 🙂,2025-01-09 21:34:28
User1,It is so different from what I am doing to earn a life,2025-01-10 02:55:28
User2,what do you do?,2025-01-10 04:36:28
User1,I am a painter,2025-01-10 08:12:28
User2,oh wow what type of paintings do you do?,2025-01-10 11:42:28
User1,I do oil painting.,2025-01-10 14:12:28
User2,nice. like of people or nature or something else?,2025-01-10 16:12:28
User1,I do a lot of different kinds,2025-01-11 00:18:28
User2,cool I wanna see it someday,2025-01-11 05:01:28
User1,Sure! No problem!,2025-01-11 08:23:28
User1,Hi!,2025-01-11 16:47:28
User2,Do you believe in miracles?,2025-01-11 21:00:28
User1,Lol. No. I know too many people whose lives suck.,2025-01-11 22:53:28
User2,"Should we be helping them, so it sucks less?\",2025-01-12 01:17:28
User1,"It's too many of them out there. You help who you can. Regardless, I wouldn't say I believe in miracles - well, if I got promoted next cycle I might change my mind.",2025-01-12 07:58:28
User2,"Haha... Well, it sounds like career is really important to you. What matters to you the most in life?",2025-01-12 09:03:28
User1,"Right now, not much. It's unclear. Career is a good fallback because you get told what good means and you act accordingly. I haven't gone through the process of shaping my values. What about you?",2025-01-12 09:20:28
User2,I'd say that I want to live for the best possible world in my lifetime. It's probably a result of my playing too many video games as a child.,2025-01-12 13:35:28
User1,We didn't have electricity growing up. Explains a lot. Lol.,2025-01-12 13:49:28
User2,Does not having had electricity help you empathize more with people of differing backgrounds and/or makes you feel a bit a distance from those who don't understand?,2025-01-12 17:49:28
User1,It makes it easier to empathise with people who grew up lacking things. Not sure it makes me empathise with people in general. Where did you grow up?,2025-01-12 02:32:28
User2,"I grew up in the United States, but my parents were immigrants and ended up being scammed of all their money, so we moved to Taiwan to live with family for a little bit.",2025-01-12 06:07:28
User1,ALL THEIR MONEY? By a person or an organisation?,2025-01-12 10:22:28
User2,"I was kind of too young to really understand, but apparently there are people who scam Asian immigrants into investing in their own restaurant business. I know that the other part of it was that my mom got sick/hospitalized, and we didn't have insurance. To be honest, I don't really know what really happened versus what my parents want people to think. I just know that one minute I was in the US, and then they put me on a plane to Taiwan, and I never saw my stuff again. In some ways, it made me more sentimental. Would you say you are more grounded and practical as a result of your background?",2025-01-12 11:36:28
User1,Hi!,2025-01-12 07:22:28
User2,Hello!,2025-01-12 11:29:28
User1,Do you have any holiday plans for christmas?,2025-01-12 15:16:28
User2,"Nothing much, I am going to sit back and relax at home, how about you ?",2025-01-12 18:33:28
User1,Same here! I would imagine spending the whole time watching movies and netflix shows. Do you have any netflix recommendations for me?,2025-01-13 17:30:28
User2,"Netflix has great documentaries on different topics , I particularly liked wild wild country and explained, as for shows you should watch 'billions' Hope you like them!",2025-01-13 19:54:28
User1,"oh right, already seen wild wild country. What is billions about?",2025-01-14 03:56:28
User2,"It's based on the life of a wall street hedge fund owner, how he makes money and fights with the government when they try to destroy him. Very well made and has a good plot.",2025-01-14 05:38:28
User1,I have just seen 1 season of Friends I should give it another try though 🙂 Have you seen Frasier?,2025-01-14 13:15:28
User2,Not yet What's it about?,2025-01-14 14:12:28
User1,A psychiatrist working for radio .. Great humour! its actually a spinoff from a very famous series called cheers. So people are already familiar with his character.,2025-01-14 07:10:28
User2,Great! how is everything else going? how was your trip last week?,2025-01-14 11:53:28
User1,"Everything is ok, had a really nice trip. Visited SF, Grand canyon and Vegas. Was a lot of fun exploring all these new places. Have you been to Grand canyon ?",2025-01-14 18:50:28
User2,Actually not yet! May be something i can visit this christmas 🙂,2025-01-14 22:32:28
User1,"You should visit it sometime, it's a wonderful place. Try to drive down there yourself or with a group of friends",2025-01-15 02:31:28
User2,"True! Well, thanks for your inputs! Have a good rest of the day! :)",2025-01-15 06:16:28
User1,Nice talking to you too!,2025-01-15 07:00:28
User1,Hi!,2025-01-15 14:14:28
User2,Hi there!,2025-01-15 15:54:28
User1,are you participating in the mentorship program this cycle?,2025-01-15 20:13:28
User2,You mean as a mentor or a mentee?,2025-01-15 23:05:28
User1,either of them... I find mentorship overall pretty useful,2025-01-15 21:58:28
User2,I have done it in the past but not this cycle. What about you?,2025-01-16 02:58:28
User1,I signed up this time to be a mentee. I have got a good mentor .,2025-01-16 04:03:28
User2,"Wow, that is nice of you. For the mentor program, personally I prefer more 1:1 conversations than the group discussions. The group discussion i useful as well but the topics are too general.",2025-01-16 08:48:28
User1,"yeah... I certainly prefer 1:1 as well, but sometimes it good to hear other peer perspective as well.",2025-01-16 16:36:28
User2,Thanks for sharing your experience! Now I am thinking maybe I should join as a mentor as well since I enjoyed it as a mentee 🙂,2025-01-16 17:33:28
User1,Great! What sort of things do you plan to mentor on?,2025-01-16 12:29:28
User2,"Hmm, maybe about work life balance 😉",2025-01-16 15:38:28
User1,Very cool. I have been working on my communication skills with my mentor this cycle,2025-01-16 03:22:28
User2,Ah I see. How is it going?,2025-01-16 04:22:28
User1,"Going good. In the last session, everyone had to actually prepare and give a presentation. Pretty serious stuff 😉",2025-01-16 08:51:28
User1,Hi!,2025-01-16 05:12:28
User2,Hey! How are you feeling today?,2025-01-16 07:07:28
User1,Good you?,2025-01-16 08:30:28
User2,I'm a little scared because I have to cook dinner for some friends tonight.,2025-01-16 12:54:28
User1,where did you meet them?,2025-01-16 15:35:28
User2,"At college, when we were all studying geology.",2025-01-16 16:02:28
User1,cool. have you graduated already?,2025-01-16 19:58:28
User2,"Yes, we graduated back in the seventies. We meet for dinner every year and take turns to host.",2025-01-17 00:25:28
User1,neat. what are y'all eating?,2025-01-17 06:09:28
User2,I don't know!! That's what I'm scared about. Everyone else is a great cook and I'm a klutz. Do you like cooking?,2025-01-17 09:11:28
User1,"lol what's a klutz? yeah I like, but I'm not good",2025-01-17 11:06:28
User2,What's your favorite dish to cook? Do you have a go-to?,2025-01-17 13:09:28
User1,ground beef pretty easy,2025-01-17 18:42:28
User2,"Ah, solid. What's your favorite sport?",2025-01-17 19:03:28
User1,I like badminton. I'm quite decent at it,2025-01-17 22:48:28
User2,"I played that in high school once or twice. I liked that it's pretty easy for beginners, unlike, say, squash.",2025-01-18 02:39:28
User1,I never played squash. would love to try,2025-01-18 09:11:28
User2,Don't! It's very hard! You feel like an idiot until you've practiced for months and months.,2025-01-18 11:11:28
User1,hi,2025-01-18 14:35:28
User2,i was talking to robot all the time:),2025-01-18 14:38:28
User1,haha. what are you talking about?,2025-01-18 22:11:28
User2,kpop...,2025-01-19 01:10:28
User1,ok. who's your favorite group,2025-01-19 04:42:28
User2,i dont like kpop now,2025-01-19 05:03:28
User1,why not?,2025-01-19 11:41:28
User2,im old now,2025-01-19 14:00:28
User1,hahaha,2025-01-19 15:29:28
User2,what do you like now?,2025-01-19 20:12:28
User1,john mayer:)\,2025-01-19 23:58:28
User2,I think I know him. does he have a sort of mellow style?,2025-01-20 03:20:28
User1,what is mellow style,2025-01-20 05:10:28
User2,I think it's like a bit sad and slow,2025-01-20 08:48:28
User1,umm yes he has some but not all,2025-01-20 14:53:28
User2,you mean some songs of his are like that but not all?,2025-01-20 15:22:28
User1,yes I do. you act like a robot how about me? am I like a robot?,2025-01-20 18:02:28
User2,a little bit haha,2025-01-20 19:12:28
User1,Hi!,2025-01-21 23:38:28
User2,Hi,2025-01-22 03:43:28
User1,Okay...so I need someone to help me though a scenario I've been pondering.,2025-01-22 04:48:28
User2,"Sure, whats the scenario?",2025-01-22 06:12:28
User1,My partner's former friend invited me for lunch (they are not in good books right now). But during their friendship I formed an independent bond with the other person because we all used to hang out a lot. Now I feel like I have to take sides.,2025-01-22 10:03:28
User2,"That's a tough scenario to be in 🙂 I firmly believe in talking this through with your partner. Though i don't know the specifics of why things went bad between your partner and his friend, but I believe things can always improve between friends.",2025-01-22 10:45:28
User1,I hope they do. Getting older already means smaller circles. It sucks to lose friends for arbitrary reasons. That's good advice though. I fear raising the issue might sound like treason. Lol.,2025-01-22 14:24:28
User2,True about that! I also think time helps to heal certain situations. So may be doing nothing is the best way forward.,2025-01-22 18:47:28
User1,AKA avoiding all texts from everyone?,2025-01-23 00:02:28
User2,"Nope, that would be extreme. May be just putting some balance between the two options.",2025-01-23 01:05:28
User1,People always say to find a balance but never say what the balance is. It's used so often that it's vacuous.,2025-01-23 07:13:28
User2,"Right, I guess that's because there is no one answer to this. It depends on what you value more and some factors around you. Also, life won't be interesting if others are figuring things out for you 😉",2025-01-23 08:27:28
User1,Lol. I'm finna be single.,2025-01-23 11:33:28
User2,"Hehe, everyone is much finer being single 🙂",2025-01-23 15:50:28
User1,Hi!,2025-01-23 13:18:28
User2,Hello there!,2025-01-23 14:58:28
User1,How's your day going?,2025-01-23 19:48:28
User2,"I've seen better days, how about you?",2025-01-23 22:11:28
User1,I'm good I'm good. What's getting you down?,2025-01-24 02:25:28
User2,"The clouds overhead are playing on your mind, any plans for the coming vacations?",2025-01-24 05:45:28
User1,I'm thinking of going to visit my family. How about you?,2025-01-24 02:50:28
User2,"Was thinking the same, where does your family live?",2025-01-24 07:18:28
User1,They're in New York. How about yours?,2025-01-24 11:31:28
User2,"Mine is in India, it is a long way away.",2025-01-24 15:23:28
User1,Ahh what city? I've visited India before.,2025-01-24 18:44:28
User2,"Hyderabad, it is a beautiful city in the southern part of India. Which cities have you gone to in India?",2025-01-24 23:08:28
User1,Hyderabad! and Bangalore! Great food in both cities! Is it still hot this time of year?,2025-01-25 23:54:28
User2,"It varies, but can go till 30C in the winters as well. New York must be snowing right?",2025-01-26 00:21:28
User1,Yes. I was actually just there a few weeks ago for Thanksgiving and got to see the first snow of the season! Ever been to New York?,2025-01-26 01:32:28
User2,"No, I've never been to the East Coast, thinking of going after the winter, I don't like the cold.",2025-01-26 04:32:28
User1,Hi!,2025-01-26 06:53:28
User2,"Hey, how are you?",2025-01-26 11:15:28
User1,I'm good. How are you doing today?,2025-01-26 13:36:28
User2,"Great, just had some delicious lunch. How about you?",2025-01-26 16:40:28
User1,I was flying my kite today in the sunshine! What did you have for lunch?,2025-01-26 21:00:28
User2,nice! Garbanzo fritters and mussels 🙂,2025-01-26 22:39:28
User1,Oh that is great! I love seafood - especially shellfish!,2025-01-27 05:38:28
User2,"yeah, it's very healthy too. I want to someday go crabbing..it is really popular in SF",2025-01-27 08:31:28
User1,Oh nice! Is it hard?,2025-01-27 09:50:28
User2,"not really, it just requires a lot of patience. You fill up the bait in the crab-pot and drop it in the ocean. Then you wait for a couple of hours to pull the crab-pots out, and voila, you'd have crabs -- if you are lucky!",2025-01-27 10:34:28
User1,"Oh wow, you sound like an expert! Have you done this before?",2025-01-27 03:51:28
User2,nah! Just watched a lot of youtube videos,2025-01-27 08:30:28
User1,"haha, you really have done your research I suppose! Ever done any other kind of fishing or hunting?",2025-01-27 11:30:28
User2,"nope, but I've seen a lot of videos on that too",2025-01-27 15:34:28
User1,"Ahh, would you consider yourself an outdoorsy type of person?",2025-01-27 19:23:28
User2,"depends on the day. Some days I'm very outdoorsy, on others I just like to be inside",2025-01-27 20:53:28
User1,Hi!,2025-01-27 09:55:28
User2,Hi there,2025-01-27 13:14:28
User1,How's your day going?,2025-01-27 16:03:28
User2,"So far so good. It is Wednesday. To more days, yeah",2025-01-27 16:26:28
User1,Haha are you looking forward to the weekend?,2025-01-27 17:45:28
User2,"Yeah, gonna watch <REDACTED_TERM> with my friends. First time. So excited.",2025-01-27 22:17:28
User1,Oh wow! Are you going to watch it live? Or watch it on TV?,2025-01-28 04:40:28
User2,Live in san jose This Saturday.,2025-01-28 06:12:28
User1,"Oh, the sharks??? Hokey is actually really fun live! Although, it can be a little violent.. haha",2025-01-28 06:28:28
User2,"Yeah! That what I heard as well. There are players just for fight! Wow, must be fun to watch lol Are you planning anything for the weekend?",2025-01-28 08:18:28
User1,You might like the UFC haha. I actually have a jiu jitsu tournament coming up so this weekend I will be training!,2025-01-28 16:31:28
User2,"lol I will try if I can watch ufc live 😉 Wow, when did you start jiu jitsu?",2025-01-28 20:53:28
User1,"It's just been a little over a year. I'm still pretty amateur, but I figured I should give competing a try and just put myself out there.",2025-01-29 00:34:28
User2,"wow, that's amazing. Good luck with it!",2025-01-29 04:38:28
User1,"Yeah, as long as I do not pass out, I will consider that a win!",2025-01-29 12:21:28
User2,lol I will cross my fingers for you then,2025-01-29 14:47:28
User1,Where do you stay?,2025-01-29 17:04:28
User2,At Home :),2025-01-29 21:13:28
User1,Who created You?,2025-01-30 05:10:28
User2,A humble man made me!,2025-01-30 05:23:28
User1,Hi!,2025-01-30 03:01:28
User2,"Hey, how're you doing? Busy with your work?",2025-01-30 03:16:28
User1,"Yes, actually it was a very busy day! How's your day so far?",2025-01-30 05:12:28
User2,"Well, usual workday. Reading others' code, debugging, experimenting…",2025-01-30 09:29:28
User1,Hope you are having fun doing that 🙂 Any plans for the weekend?,2025-01-30 13:47:28
User2,Not yet. I am actually thinking about traveling to Europe next spring. What about you?,2025-01-30 16:43:28
User1,Europe sounds fun! I will just stay home and watch the game. Where in europe do you plan to visit?,2025-01-31 00:10:28
User2,"I like all the historical sites, so probably France, Germany, or Italy.",2025-01-31 04:57:28
User1,Sounds great! I recommend spain. It's perfect for road trips.,2025-01-31 09:20:28
User2,"I also need to pick up my Spanish. I learned it in my college, but since then haven't used it that much.",2025-01-31 12:02:28
User1,"Yep, i tried learning spanish too, but couldn't make much progress. But i should do decent with my german.",2025-01-31 18:18:28
User2,True! I learnt it from school. But didn't get much chance to speak. Hope you have fun with your trip!,2025-01-31 19:22:28
User1,Thanks! Let me try to make all the arrangement as soon as possible. Hope you also enjoy your weekday and weekend as well,2025-01-31 23:18:28
User1,Hi!,2025-02-01 20:05:28
User2,Hey! How's your day been?,2025-02-01 23:44:28
User1,It's good! I spent most of it watching horse racing. How about yourself?,2025-02-02 13:43:28
User2,"nice! what's your favorite part about watching horse racing? My day has been pretty busy, but I had a nice lunch with a friend. It was good to catchup with him",2025-02-02 14:20:28
User1,"I actually like to put down some money, but I wouldn't call it my favorite part, since I usually lose it... haha. Catching up with friends is great! How long had it been?",2025-02-02 20:09:28
User2,"The last I saw him was a month ago! So yup it was great Haha, nice 🙂 Got any fun plans for the weekend?",2025-02-03 00:01:28
User1,I'm thinking of going deep sea fishing. Ever tried that before?,2025-02-03 21:53:28
User2,"Nope I haven't, have you been fishing before?",2025-02-03 23:10:28
User1,Just once! I got super sea sick.. haha Have any fun weekend plans yourself?,2025-02-04 07:06:28
User2,"Haha 😆 Yeah I get sea sick on boats too Nothing much, just visiting some friends in San Francisco",2025-02-04 10:27:28
User1,Oh very cool. I hear its nice over there. Do you go often?,2025-02-04 16:59:28
User2,Yeah I would say maybe every couple weeks or so what are your favorite cities to visit?,2025-02-04 18:50:28
User1,"New York is the top of my list because my family lives there! As far as the city itself though... I think I'd prefer someplace outside of the US, like Tokyo. What about you?",2025-02-04 12:49:28
User2,"nice! I love NYC 🙂 so fun to visit yeah I would probably also say New York is my favorite city inside the US I also like Paris, it's so pretty there",2025-02-04 14:24:28
User1,"Oh I've never been! It is such an iconic place, I have to make the time to get there soon.",2025-02-04 17:14:28
User2,"You should, it's a beautiful city!",2025-02-04 18:45:28
User1,Hi!,2025-02-04 16:07:28
User2,"Hello, how are you doing today?",2025-02-04 16:39:28
User1,I heard they are giving out some goodies in microkitchen.,2025-02-05 00:03:28
User2,I love pop ups! What kind of goodies are they giving away?,2025-02-05 04:41:28
User1,I guess its a jacket! Very much needed that in the cold 🙂,2025-02-05 10:33:28
User2,"That's such a great idea, especially at this time of the year. I'm not too big a fan of the cold. I prefer warmer climates. Do you enjoy the cold?",2025-02-05 14:27:28
User1,Sure hate it! Limits our ability to go out even for a walk! Its good that we don't get to suffer extreme cold weather!,2025-02-05 15:19:28
User2,Me too! I moved here a few years ago to get out of the extreme cold. I do not care for bundling up and having to wear so many layers just to go buy eggs at the store.,2025-02-05 18:22:28
User1,Oh nice! Where did you live before?,2025-02-05 21:17:28
User2,Upstate New York. We got a foot of snow every week during my last winter there. I am so glad to not have to shovel snow now,2025-02-05 22:48:28
User1,"New york! Nice! Best place to live 🙂 .. right, except for the cold!",2025-02-06 01:08:28
User2,"Very beautiful during all the seasons but yes, summer and winter can get extreme!",2025-02-06 04:37:28
User1,"Anyways, i guess we should better hurry up to get the goodies. I remember last time they ran out of it.",2025-02-06 05:43:28
User2,Very true. Which MK were they in again?,2025-02-06 09:03:28
User1,The one in our floor. I will get by your desk and we can walk there.,2025-02-06 11:19:28
User2,"Sounds good, thanks!",2025-02-06 14:53:28
User1,Hi!,2025-02-06 04:53:28
User2,How's your day going?,2025-02-06 05:09:28
User1,"Pretty busy, lots of work to finish up. You?",2025-02-06 09:28:28
User2,Likewise. What have you been up to that gives you so much work?,2025-02-06 10:33:28
