User,Message,Timestamp
User2,I don't know!! That's what I'm scared about. Everyone else is a great cook and I'm a klutz. Do you like cooking?,2025-01-05 01:20:15
User1,"lol what's a klutz? yeah I like, but I'm not good",2025-01-05 04:59:15
User2,What's your favorite dish to cook? Do you have a go-to?,2025-01-05 05:30:15
User1,ground beef pretty easy,2025-01-05 12:00:15
User2,"Ah, solid. What's your favorite sport?",2025-01-05 16:39:15
User1,I like badminton. I'm quite decent at it,2025-01-05 18:41:15
User2,"I played that in high school once or twice. I liked that it's pretty easy for beginners, unlike, say, squash.",2025-01-05 13:27:15
User1,I never played squash. would love to try,2025-01-05 16:11:15
User2,Don't! It's very hard! You feel like an idiot until you've practiced for months and months.,2025-01-05 19:41:15
User1,hi,2025-01-06 12:56:15
User2,i was talking to robot all the time:),2025-01-06 15:07:15
User1,haha. what are you talking about?,2025-01-06 22:38:15
User2,kpop...,2025-01-07 02:10:15
User1,ok. who's your favorite group,2025-01-07 08:58:15
User2,i dont like kpop now,2025-01-07 09:49:15
User1,why not?,2025-01-07 17:34:15
User2,im old now,2025-01-07 21:18:15
User1,hahaha,2025-01-08 04:34:15
User2,what do you like now?,2025-01-08 06:23:15
User1,john mayer:)\,2025-01-08 07:26:15
User2,I think I know him. does he have a sort of mellow style?,2025-01-08 20:06:15
User1,what is mellow style,2025-01-09 00:19:15
User2,I think it's like a bit sad and slow,2025-01-09 02:40:15
User1,umm yes he has some but not all,2025-01-09 10:04:15
User2,you mean some songs of his are like that but not all?,2025-01-09 08:52:15
User1,yes I do. you act like a robot how about me? am I like a robot?,2025-01-09 10:42:15
User2,a little bit haha,2025-01-09 12:08:15
User1,Hi!,2025-01-09 17:18:15
User2,Hi,2025-01-09 22:05:15
User1,Okay...so I need someone to help me though a scenario I've been pondering.,2025-01-10 01:05:15
User2,"Sure, whats the scenario?",2025-01-10 05:55:15
User1,My partner's former friend invited me for lunch (they are not in good books right now). But during their friendship I formed an independent bond with the other person because we all used to hang out a lot. Now I feel like I have to take sides.,2025-01-10 04:09:15
User2,"That's a tough scenario to be in 🙂 I firmly believe in talking this through with your partner. Though i don't know the specifics of why things went bad between your partner and his friend, but I believe things can always improve between friends.",2025-01-10 06:20:15
User1,I hope they do. Getting older already means smaller circles. It sucks to lose friends for arbitrary reasons. That's good advice though. I fear raising the issue might sound like treason. Lol.,2025-01-10 11:33:15
User2,True about that! I also think time helps to heal certain situations. So may be doing nothing is the best way forward.,2025-01-10 11:51:15
User1,AKA avoiding all texts from everyone?,2025-01-10 13:01:15
User2,"Nope, that would be extreme. May be just putting some balance between the two options.",2025-01-10 17:23:15
User1,People always say to find a balance but never say what the balance is. It's used so often that it's vacuous.,2025-01-10 19:09:15
User2,"Right, I guess that's because there is no one answer to this. It depends on what you value more and some factors around you. Also, life won't be interesting if others are figuring things out for you 😉",2025-01-10 18:20:15
User1,Lol. I'm finna be single.,2025-01-10 23:58:15
User2,"Hehe, everyone is much finer being single 🙂",2025-01-10 23:59:15
User1,Hi!,2025-01-11 12:32:15
User2,Hello there!,2025-01-11 15:27:15
User1,How's your day going?,2025-01-11 20:52:15
User2,"I've seen better days, how about you?",2025-01-11 23:01:15
User1,I'm good I'm good. What's getting you down?,2025-01-12 01:45:15
User2,"The clouds overhead are playing on your mind, any plans for the coming vacations?",2025-01-12 03:44:15
User1,I'm thinking of going to visit my family. How about you?,2025-01-12 15:32:15
User2,"Was thinking the same, where does your family live?",2025-01-12 16:27:15
User1,They're in New York. How about yours?,2025-01-12 23:08:15
User2,"Mine is in India, it is a long way away.",2025-01-12 23:28:15
User1,Ahh what city? I've visited India before.,2025-01-13 03:24:15
User2,"Hyderabad, it is a beautiful city in the southern part of India. Which cities have you gone to in India?",2025-01-13 17:09:15
User1,Hyderabad! and Bangalore! Great food in both cities! Is it still hot this time of year?,2025-01-13 23:52:15
User2,"It varies, but can go till 30C in the winters as well. New York must be snowing right?",2025-01-14 04:52:15
User1,Yes. I was actually just there a few weeks ago for Thanksgiving and got to see the first snow of the season! Ever been to New York?,2025-01-14 09:20:15
User2,"No, I've never been to the East Coast, thinking of going after the winter, I don't like the cold.",2025-01-14 23:45:15
User1,Hi!,2025-01-15 07:46:15
User2,"Hey, how are you?",2025-01-15 09:30:15
User1,I'm good. How are you doing today?,2025-01-15 12:54:15
User2,"Great, just had some delicious lunch. How about you?",2025-01-15 16:15:15
User1,I was flying my kite today in the sunshine! What did you have for lunch?,2025-01-15 11:37:15
User2,nice! Garbanzo fritters and mussels 🙂,2025-01-15 14:23:15
User1,Oh that is great! I love seafood - especially shellfish!,2025-01-15 21:02:15
User2,"yeah, it's very healthy too. I want to someday go crabbing..it is really popular in SF",2025-01-16 01:57:15
User1,Oh nice! Is it hard?,2025-01-16 08:09:15
User2,"not really, it just requires a lot of patience. You fill up the bait in the crab-pot and drop it in the ocean. Then you wait for a couple of hours to pull the crab-pots out, and voila, you'd have crabs -- if you are lucky!",2025-01-16 08:27:15
User1,"Oh wow, you sound like an expert! Have you done this before?",2025-01-16 07:38:15
User2,nah! Just watched a lot of youtube videos,2025-01-16 11:22:15
User1,"haha, you really have done your research I suppose! Ever done any other kind of fishing or hunting?",2025-01-16 08:08:15
User2,"nope, but I've seen a lot of videos on that too",2025-01-16 12:50:15
User1,"Ahh, would you consider yourself an outdoorsy type of person?",2025-01-16 14:03:15
User2,"depends on the day. Some days I'm very outdoorsy, on others I just like to be inside",2025-01-16 16:57:15
User1,Hi!,2025-01-16 06:59:15
User2,Hi there,2025-01-16 09:54:15
User1,How's your day going?,2025-01-16 14:31:15
User2,"So far so good. It is Wednesday. To more days, yeah",2025-01-16 19:30:15
User1,Haha are you looking forward to the weekend?,2025-01-16 19:38:15
User2,"Yeah, gonna watch <REDACTED_TERM> with my friends. First time. So excited.",2025-01-16 21:13:15
User1,Oh wow! Are you going to watch it live? Or watch it on TV?,2025-01-17 04:53:15
User2,Live in san jose This Saturday.,2025-01-17 21:47:15
User1,"Oh, the sharks??? Hokey is actually really fun live! Although, it can be a little violent.. haha",2025-01-18 04:00:15
User2,"Yeah! That what I heard as well. There are players just for fight! Wow, must be fun to watch lol Are you planning anything for the weekend?",2025-01-18 19:05:15
User1,You might like the UFC haha. I actually have a jiu jitsu tournament coming up so this weekend I will be training!,2025-01-19 02:34:15
User2,"lol I will try if I can watch ufc live 😉 Wow, when did you start jiu jitsu?",2025-01-19 07:23:15
User1,"It's just been a little over a year. I'm still pretty amateur, but I figured I should give competing a try and just put myself out there.",2025-01-19 07:31:15
User2,"wow, that's amazing. Good luck with it!",2025-01-19 10:08:15
User1,"Yeah, as long as I do not pass out, I will consider that a win!",2025-01-19 16:20:15
User2,lol I will cross my fingers for you then,2025-01-19 17:48:15
User1,Where do you stay?,2025-01-19 22:50:15
User2,At Home :),2025-01-20 03:42:15
User1,Who created You?,2025-01-20 05:51:15
User2,A humble man made me!,2025-01-20 07:24:15
User1,Hi!,2025-01-20 21:13:15
User2,"Hey, how're you doing? Busy with your work?",2025-01-21 00:15:15
User1,"Yes, actually it was a very busy day! How's your day so far?",2025-01-21 04:23:15
User2,"Well, usual workday. Reading others' code, debugging, experimenting…",2025-01-21 08:32:15
User1,Hope you are having fun doing that 🙂 Any plans for the weekend?,2025-01-21 13:43:15
User2,Not yet. I am actually thinking about traveling to Europe next spring. What about you?,2025-01-21 05:55:15
User1,Europe sounds fun! I will just stay home and watch the game. Where in europe do you plan to visit?,2025-01-21 11:02:15
User2,"I like all the historical sites, so probably France, Germany, or Italy.",2025-01-21 09:38:15
User1,Sounds great! I recommend spain. It's perfect for road trips.,2025-01-21 13:44:15
User2,"I also need to pick up my Spanish. I learned it in my college, but since then haven't used it that much.",2025-01-21 16:10:15
User1,"Yep, i tried learning spanish too, but couldn't make much progress. But i should do decent with my german.",2025-01-21 22:26:15
User2,True! I learnt it from school. But didn't get much chance to speak. Hope you have fun with your trip!,2025-01-22 01:22:15
User1,Thanks! Let me try to make all the arrangement as soon as possible. Hope you also enjoy your weekday and weekend as well,2025-01-22 03:51:15
User1,Hi!,2025-01-22 10:48:15
User2,Hey! How's your day been?,2025-01-22 10:55:15
User1,It's good! I spent most of it watching horse racing. How about yourself?,2025-01-22 15:21:15
User2,"nice! what's your favorite part about watching horse racing? My day has been pretty busy, but I had a nice lunch with a friend. It was good to catchup with him",2025-01-22 18:59:15
User1,"I actually like to put down some money, but I wouldn't call it my favorite part, since I usually lose it... haha. Catching up with friends is great! How long had it been?",2025-01-23 01:43:15
User2,"The last I saw him was a month ago! So yup it was great Haha, nice 🙂 Got any fun plans for the weekend?",2025-01-23 06:43:15
User1,I'm thinking of going deep sea fishing. Ever tried that before?,2025-01-23 09:11:15
User2,"Nope I haven't, have you been fishing before?",2025-01-23 11:50:15
User1,Just once! I got super sea sick.. haha Have any fun weekend plans yourself?,2025-01-23 16:01:15
User2,"Haha 😆 Yeah I get sea sick on boats too Nothing much, just visiting some friends in San Francisco",2025-01-23 17:51:15
User1,Oh very cool. I hear its nice over there. Do you go often?,2025-01-23 23:41:15
User2,Yeah I would say maybe every couple weeks or so what are your favorite cities to visit?,2025-01-24 01:41:15
User1,"New York is the top of my list because my family lives there! As far as the city itself though... I think I'd prefer someplace outside of the US, like Tokyo. What about you?",2025-01-24 14:27:15
User2,"nice! I love NYC 🙂 so fun to visit yeah I would probably also say New York is my favorite city inside the US I also like Paris, it's so pretty there",2025-01-24 18:46:15
User1,"Oh I've never been! It is such an iconic place, I have to make the time to get there soon.",2025-01-25 00:25:15
User2,"You should, it's a beautiful city!",2025-01-25 02:42:15
User1,Hi!,2025-01-25 21:25:15
User2,"Hello, how are you doing today?",2025-01-26 01:49:15
User1,I heard they are giving out some goodies in microkitchen.,2025-01-26 06:48:15
User2,I love pop ups! What kind of goodies are they giving away?,2025-01-26 08:59:15
User1,I guess its a jacket! Very much needed that in the cold 🙂,2025-01-26 12:54:15
User2,"That's such a great idea, especially at this time of the year. I'm not too big a fan of the cold. I prefer warmer climates. Do you enjoy the cold?",2025-01-26 15:49:15
User1,Sure hate it! Limits our ability to go out even for a walk! Its good that we don't get to suffer extreme cold weather!,2025-01-26 16:09:15
User2,Me too! I moved here a few years ago to get out of the extreme cold. I do not care for bundling up and having to wear so many layers just to go buy eggs at the store.,2025-01-26 16:28:15
User1,Oh nice! Where did you live before?,2025-01-26 22:32:15
User2,Upstate New York. We got a foot of snow every week during my last winter there. I am so glad to not have to shovel snow now,2025-01-27 00:49:15
User1,"New york! Nice! Best place to live 🙂 .. right, except for the cold!",2025-01-27 01:42:15
User2,"Very beautiful during all the seasons but yes, summer and winter can get extreme!",2025-01-27 03:13:15
User1,"Anyways, i guess we should better hurry up to get the goodies. I remember last time they ran out of it.",2025-01-27 10:53:15
User2,Very true. Which MK were they in again?,2025-01-27 11:22:15
User1,The one in our floor. I will get by your desk and we can walk there.,2025-01-27 11:41:15
User2,"Sounds good, thanks!",2025-01-27 11:43:15
User1,Hi!,2025-01-27 22:18:15
User2,How's your day going?,2025-01-28 00:10:15
User1,"Pretty busy, lots of work to finish up. You?",2025-01-28 00:56:15
User2,Likewise. What have you been up to that gives you so much work?,2025-01-28 01:41:15
User1,A couple projects that I am trying to finish up before Thanksgiving 🙂 Do you have any fun plans for the break?,2025-01-28 06:48:15
User2,What is a break? I'm a grad student. I don't understand the concept of a break. Just kidding. I don't have any plan. Probably just going to work through the break.,2025-01-28 10:25:15
User1,Haha XD so what do you like to do for fun?,2025-01-28 10:36:15
User2,I go to the gym and run until I find enough fun.,2025-01-28 11:44:15
User1,"cool! I've started to run a bit as well not long distances though, just a couple miles",2025-01-28 17:15:15
User2,"A couple of miles is very impressive. When I started, I couldn't even last 1 mile.",2025-01-28 19:44:15
User1,haha,2025-01-29 03:18:15
User2,I'm exhausted by the end of it though 😛 Do you like to run long distances or mostly sprints?,2025-01-29 07:19:15
User1,I like to do long distances. I have run a few marathons.,2025-01-29 12:16:15
User2,wow! that's amazing did you do any marathons this year?,2025-01-29 05:37:15
User1,"No. Not this year. This is my half-marathon year. Instead of running marathons, I run one half-marathon every month.",2025-01-29 11:43:15
User2,"oh wow, what was the last half marathon you did?",2025-01-29 14:52:15
User1,Two days ago. It was a tough one.,2025-01-29 20:14:15
User2,Cool!,2025-01-29 22:01:15
User1,Hi!,2025-01-29 15:39:15
User2,"hello there, how is it going?",2025-01-29 20:03:15
User1,Pretty great. I just won a pingpong game. What about you?,2025-01-30 03:44:15
User2,that's nice. I am just working on some documentation. Do you play pingpong often?,2025-01-30 04:46:15
User1,"No, very rarely. It's kind of amazing that I won, but I'm still taking credit for it.",2025-01-30 12:45:15
User2,"thats very impressive then, congrats!",2025-01-30 16:31:15
User1,"Haha thank you, I guess I'm just a natural. What's your favourite game?",2025-01-30 17:50:15
User2,"I really like to play tennis, badminton and racquetball. I don't really get a chance to play them often though, specially racquetball",2025-01-30 19:22:15
User1,"What's racquetball like? From context clues, I'm guessing that it involves hitting a ball with a racquet",2025-01-30 01:03:15
User2,"well, it's like a cage match of tennis. The main difference is that both players play in the same 'court' and the ball is smashed against a wall instead of passing it over a net into the opponent's court. Kind of like playing pingpong vs the table.",2025-01-30 03:21:15
User1,Wow! A cage match! Does it get physical?,2025-01-30 06:16:15
User2,"it depends haha, there is a lot of bumping into each other to run after the ball, and sometimes the ball hits you too. Overall it feels like a super fast paced version of tennis, really tiring!",2025-01-30 11:37:15
User1,"That sounds fun. I think of tennis itself as being really athletic and tiring, so I don't think it's a sport for me, though!",2025-01-30 14:57:15
User2,ping pong can get quite intensive too! I guess short ping pong sessions are not that tiring though. Wanna have a match?,2025-01-30 17:08:15
User1,"What a good idea, I'd love to!",2025-01-30 17:36:15
User1,Show me your anger!!!!,2025-01-30 20:52:15
User2,Fuckkkkkkk!!!!,2025-01-30 22:03:15
User1,Hi!,2025-01-30 17:50:15
User2,hi,2025-01-30 20:02:15
User1,what are you up to?,2025-01-30 21:59:15
User2,code refactoring. you?,2025-01-31 00:58:15
User1,me? just chilling out at work. what is code refactoring?,2025-01-31 19:30:15
User2,good question. I don't even know what I am doing,2025-02-01 00:20:15
User1,"haha, forget it. what else do you like to do beside work?",2025-02-01 04:41:15
User2,lots of fun stuff. eating sleeping 🙂,2025-02-01 06:58:15
User1,these are important things to do in life 😉,2025-02-01 12:49:15
User2,yeah. keep minimalist life style only do things you have to do 🙂,2025-02-01 12:50:15
User1,what food do you like to eat?,2025-02-01 18:59:15
User2,Asian food prefer spicy one,2025-02-01 19:15:15
User1,like Szechuan or Hunan? 🙂,2025-02-02 00:07:15
User2,yes yes yes! like that style. Do you like spicy food?,2025-02-02 00:08:15
User1,I like noodle soup like Pho or Ramen. I also like Beijing duck a lot!,2025-02-02 05:05:15
User2,what is your favorite place for ramen?,2025-02-02 09:30:15
User1,I love <REDACTED_TERM> in San Mateo,2025-02-02 10:19:15
User2,haven't tried that one! will give it a try next time!,2025-02-02 14:59:15
User1,"yes, you should!",2025-02-02 15:25:15
User1,Hi!,2025-02-02 20:11:15
User2,Hi!,2025-02-02 20:23:15
User1,nice meeting you. what are you up to?,2025-02-02 22:07:15
User2,"not much, thinking about lunch",2025-02-02 04:40:15
User1,"yea, same here. any food you're craving for?",2025-02-02 08:29:15
User2,I love sushi do you know of any good sushi places?,2025-02-02 17:00:15
User1,arghhh hard question ... I only know Ramen places for Japanese food 🙂,2025-02-02 23:32:15
User2,ooh ramen is also good,2025-02-03 03:01:15
User1,San Mateo to me has the best Ramen restaurants: Parlor and Dojo? oh no question mark 🙂,2025-02-03 04:16:15
User2,I haven't been to those palces before. Going to have to check them out! thanks for teh recommendation,2025-02-03 07:07:15
User1,my pleasure 🙂 do you live near San Mateo?,2025-02-03 07:43:15
User2,"no, but I'm willing to drive for good ramen",2025-02-03 12:40:15
User1,excellent. let me know when you have tried those. I like Parlor better because it has soft-shell crabs,2025-02-03 13:13:15
User2,"I""ve never had softshell crab before, but it sounds really good!",2025-02-03 15:22:15
User1,yup it's delicious!,2025-02-03 21:12:15
User1,Hi!,2025-02-03 16:16:15
User2,"Hey, how's your day going?",2025-02-03 17:20:15
User1,"okayish, it is flying by quicker than I expected. How is your day going on?",2025-02-03 22:45:15
User2,"Slowly, not much to do. Been twiddling my thumbs all day what have you been up to?",2025-02-04 03:41:15
User1,"Oh, I would love to twiddle my thumbs. You're so lucky! Today, I've been mostly attending meetings, reading and writing docs, reading papers etc.",2025-02-04 08:09:15
User2,That's a lot! I've just been cloud gazing - I saw a giraffe and an ice cream cone,2025-02-04 08:52:15
User1,"wow! I sometimes drift off during work, and see similar things in my head.",2025-02-04 09:18:15
User2,What kind of work do you do?,2025-02-04 12:10:15
User1,Mostly saving the world from mess on social media. How about you?,2025-02-04 16:45:15
User2,I'm taking a break from work. Going to go travel the world,2025-02-04 19:09:15
User1,"Nice, what all places would you be going to?",2025-02-04 20:24:15
User2,Australia and New Zealand to start then maybe Singapore,2025-02-04 22:42:15
User1,"I just met someone who went diving in Australia. Apparently, you cannot fly 24 hrs after you dive, because your body accumulates too much <REDACTED_TERM> when breathing with a cylinder So, don't do that!",2025-02-05 14:50:15
User2,"Thank you for the tip! I don't plan on going diving, I plan to hike the mountains and go see kangaroos!",2025-02-05 16:21:15
User1,That's equally amazing! I wish I can explore such places one day. It's just so expensive,2025-02-05 21:00:15
User2,I won a lot of money through the lottery 🙂,2025-02-05 22:35:15
User1,woah!... You know sharing is caring. You should share that money with me :),2025-02-06 03:48:15
User2,"Haha, very true! Besides the trip, I donated the rest to charity so I will need to go back to work when I get back",2025-02-06 06:19:15
User1,you are a kind soul!,2025-02-06 14:28:15
User1,Hi!,2025-02-06 10:16:15
User2,Hi!,2025-02-06 13:22:15
User1,How is your day going?,2025-02-06 20:41:15
User2,It is pretty good. A little bit tired though.,2025-02-07 01:17:15
User1,How is your day?,2025-02-07 02:39:15
User2,"My day is okay. At least, I'm not tired. What made you tired?",2025-02-07 02:52:15
User1,I went to gym and worked on weight lifting.,2025-02-07 09:39:15
User2,Oh. That's hardcore. Have you been lifting for a long time?,2025-02-07 12:42:15
User1,"No, I am just a starter.",2025-02-07 19:54:15
User2,Do you go to the gym often?,2025-02-08 00:42:15
User1,"I go everyday. In fact, I'm in a running challenge.",2025-02-08 01:54:15
User2,Wow,2025-02-08 05:10:15
User1,It's actually not that impressive. I can only run. I cannot lift weight.,2025-02-08 09:46:15
User2,You can get a coach to start it!,2025-02-08 14:08:15
User1,Oh that's a really interesting idea. I like to be coa,2025-02-08 20:17:15
User1,Hi!,2025-02-08 17:16:15
User2,"Hello, how is your day?",2025-02-08 21:15:15
User1,"It's good. It's raining a bit, but I am enjoying a good book. How about you?",2025-02-09 01:53:15
User2,"It's good, I just got back from walking my dog What book did you read?",2025-02-09 03:50:15
User1,I'm reading the Three Body Problem. Ever heard of it?,2025-02-09 06:19:15
User2,"No, what is it about?",2025-02-09 10:34:15
User1,It's a sci-fi book about aliens and a type of virtual reality. Pique your interest at all?,2025-02-09 13:55:15
User2,"Slightly, I typically read fiction but I can curious what type of virtual reality is discussed in the book",2025-02-09 15:34:15
User1,Cool. This virtual reality is a based on life on an alien planet. There is a twist though. Do you want me to spoil it for you?,2025-02-09 16:18:15
User2,Yes!,2025-02-09 20:24:15
User1,The virtual reality is actually based on a real alien civilization! And that civilization is coming to attack earth! dun dun dun dunnnnnnn,2025-02-10 04:13:15
User2,Woah! That is fascinating! I will have to pick up a copy of the book to read.,2025-02-10 07:46:15
User1,"There are other twists as well, so I haven't spoiled the whole thing! To be honest I am not a fan of spoilers",2025-02-10 13:46:15
User2,Thanks for not spoiling it completely but you gave a really intriguing description that makes me want to read it now. I will have to pick it up after work,2025-02-10 16:03:15
User1,The audi book is also very good! Ever give those a try?,2025-02-10 22:19:15
User2,I only gave those a try when I had a concussion and could not read. I enjoy having a physical book in hand and reading at the pace I prefer. Do you listen to a lot of audi books?,2025-02-11 03:12:15
User1,Hi!,2025-02-11 08:23:15
User2,"Hey, how's it going?",2025-02-11 08:34:15
User1,It's good! How is your day?,2025-02-11 16:43:15
User2,My day is good. A bit sad that it gets dark so early but oh well. Did you do anything fun over the weekend?,2025-02-11 21:52:15
User1,"Yes, the darkness can be a bit depressing. This weekend I went rock climbing! It was great! How about yourself?",2025-02-12 04:45:15
User2,Rock climbing sounds fun! I had a pretty low-key weekend. Ended up going to watch a movie.,2025-02-12 08:07:15
User1,Oh nice! What movie?,2025-02-12 10:33:15
User2,"Knives Out. It had Daniel Craig and one of the famous Captain America ""Chris"" person (I can't keep track of all of the famous Chris names).",2025-02-12 11:51:15
User1,"Hahah yes, they all look the same! I saw that very same movie over Thanksgiving break. Lots of twists and turns!",2025-02-12 01:54:15
User2,"Cool. So if it weren't so dark and cold outside, what kind of activities would you do?",2025-02-12 05:40:15
User1,"Hmm good question. Evening runs can be fun, but it can be a little scary when it's dark out!",2025-02-12 10:18:15
User2,"Yeah, sunlight is good. I wish I could live part-time in different parts of the world to have summer all year round. Have you ever visited the southern hemisphere?",2025-02-12 13:59:15
User1,"Yes! I've been to Australia. It was very nice; I regret not going to see the southern lights. Me personally, I like winter. But I'd prefer it to be more brief than it actually is here... Where are you from originally?",2025-02-12 22:03:15
User2,I've always wanted to go to Australia. I'm originally from the US.,2025-02-13 00:03:15
User1,Ahh me too! You should definitely try to visit Australia at least once!,2025-02-13 00:09:15
User2,Will do! Bye.,2025-02-13 03:01:15
User1,Hi!,2025-02-13 04:24:15
User2,What's your name?,2025-02-13 07:12:15
User1,My name is pikachu. it’s nice to meet you! What are you up to this month?,2025-02-13 10:14:15
User2,"Nice to meet you pikachu! pikachu, pikachu, pikachu? (That meant, I'm literally catching Pokemons on my phone right now!) What're you up to lately?",2025-02-13 10:29:15
User1,I’m trying to organize my life and start the new year ready to go! What about you?,2025-02-13 13:16:15
User2,"Wow, that's impressive. Admit I'm just trying to take each day and week as they come.",2025-02-13 22:10:15
User1,What do you do to unwind?,2025-02-14 04:22:15
User2,"Honestly, I like to catch Pokemons on my phone a lot. That must be upsetting since your name is pikachu though...sorry...",2025-02-14 05:00:15
User1,"Oddly enough, I also catch Pokémon on my phone. I used to do it more, but it just never ends. I used to do it everyday. Now I mostly catch them when I travel somewhere exotic.",2025-02-14 10:50:15
